URI,Label,Description,Type,EdgePropertyOf,SourceClass,TargetClass
http://rdfs.org/ns/void#Dataset,Dataset,"A set of RDF triples that are published, maintained, or aggregated by a single provider and described as one dataset in the VoID vocabulary.",Class,,,
https://w3id.org/biolink/vocab/ConceptCountAnalysisResult,Concept Count Analysis Result,A result of a concept count analysis.,Class,,,
https://w3id.org/biolink/vocab/Dataset,Dataset,A collection of data items or records that can be used as evidence or supporting data in a study.,Class,,,
https://w3id.org/biolink/vocab/Disease,Disease,A pathological condition or disorder that affects an organism and is associated with signs symptoms or abnormal biological processes.,Class,,,
https://w3id.org/biolink/vocab/DiseaseToPhenotypicFeatureAssociation,Disease To Phenotypic Feature Association,An association between a disease and a phenotypic feature that may be observed in or characteristic of the disease.,Class,,,
https://w3id.org/biolink/vocab/EntityToDiseaseAssociation,Entity To Disease Association,An association between an entity and a disease.,Class,,,
https://w3id.org/biolink/vocab/LogOddsAnalysisResult,Log Odds Analysis Result,A result of a log odds ratio analysis.,Class,,,
https://w3id.org/biolink/vocab/PhenotypicFeature,Phenotypic Feature,A biological feature or observable characteristic of an organism that can be measured or described as part of a phenotype.,Class,,,
https://w3id.org/biolink/vocab/PhenotypicFeatureToPhenotypicFeatureAssociation,Phenotypic Feature To Phenotypic Feature Association,An association between two phenotypic features.,Class,,,
https://w3id.org/biolink/vocab/Study,Study,A planned investigation or analysis that produces study results and may use datasets or other evidence.,Class,,,
http://purl.org/dc/terms/modified,Date Modified,Date on which the resource was changed.,Predicate,,,
http://purl.org/pav/lastUpdatedOn,last Updated On,A date or date-time indicating when the described resource was last updated.,Predicate,,,
http://purl.org/pav/version,version,A version number or other version identifier for the described resource.,Predicate,,,
http://rdfs.org/ns/void#distinctObjects,distinct Objects,The total number of distinct resources or literals that occur in object position in triples in the dataset.,Predicate,,,
http://rdfs.org/ns/void#distinctSubjects,distinct Subjects,The total number of distinct resources that occur in subject position in triples in the dataset.,Predicate,,,
http://rdfs.org/ns/void#properties,properties,The total number of distinct properties that occur in predicate position in triples in the dataset.,Predicate,,,
http://rdfs.org/ns/void#property,property,The RDF property that is the predicate of all triples in a property-based partition.,Predicate,,,
http://rdfs.org/ns/void#propertyPartition,property Partition,A subset of a VoID dataset that contains only triples having a particular RDF property as predicate.,Predicate,,,
http://rdfs.org/ns/void#triples,triples,The total number of triples contained in a dataset.,Predicate,,,
http://www.w3.org/2000/01/rdf-schema#label,label,A human-readable version of a resource name.,Predicate,,https://w3id.org/biolink/vocab/Dataset|https://w3id.org/biolink/vocab/Disease|https://w3id.org/biolink/vocab/PhenotypicFeature,
https://w3id.org/biolink/vocab/category,category,"A Biolink category or class assigned to an entity, association, or result node.",Predicate,https://w3id.org/biolink/vocab/has_study_results,https://w3id.org/biolink/vocab/ConceptCountAnalysisResult|https://w3id.org/biolink/vocab/Dataset|https://w3id.org/biolink/vocab/Disease|https://w3id.org/biolink/vocab/DiseaseToPhenotypicFeatureAssociation|https://w3id.org/biolink/vocab/EntityToDiseaseAssociation|https://w3id.org/biolink/vocab/LogOddsAnalysisResult|https://w3id.org/biolink/vocab/PhenotypicFeature|https://w3id.org/biolink/vocab/PhenotypicFeatureToPhenotypicFeatureAssociation|https://w3id.org/biolink/vocab/Study,
https://w3id.org/biolink/vocab/concept_count_object,concept count object,The number of instances in a dataset or cohort whose records contain the concept in the object slot of an association.,Predicate,https://w3id.org/biolink/vocab/has_study_results,https://w3id.org/biolink/vocab/ConceptCountAnalysisResult,
https://w3id.org/biolink/vocab/concept_count_subject,concept count subject,The number of instances in a dataset or cohort whose records contain the concept in the subject slot of an association.,Predicate,https://w3id.org/biolink/vocab/has_study_results,https://w3id.org/biolink/vocab/ConceptCountAnalysisResult,
https://w3id.org/biolink/vocab/concept_pair_count,concept pair count,The number of instances in a dataset or cohort whose records contain both the subject and object concept of an association.,Predicate,https://w3id.org/biolink/vocab/has_study_results,https://w3id.org/biolink/vocab/ConceptCountAnalysisResult,
https://w3id.org/biolink/vocab/dataset_count,dataset count,The total number of instances in a dataset or cohort.,Predicate,https://w3id.org/biolink/vocab/has_study_results,https://w3id.org/biolink/vocab/ConceptCountAnalysisResult,
https://w3id.org/biolink/vocab/has_study_results,has study results,Connects a study to instances of its study result.,Predicate,,https://w3id.org/biolink/vocab/Study,https://w3id.org/biolink/vocab/ConceptCountAnalysisResult|https://w3id.org/biolink/vocab/LogOddsAnalysisResult
https://w3id.org/biolink/vocab/has_supporting_studies,has supporting studies,Connects an association to one or more studies that support or provide evidence for the association.,Predicate,,https://w3id.org/biolink/vocab/DiseaseToPhenotypicFeatureAssociation|https://w3id.org/biolink/vocab/EntityToDiseaseAssociation|https://w3id.org/biolink/vocab/PhenotypicFeatureToPhenotypicFeatureAssociation,https://w3id.org/biolink/vocab/Study
https://w3id.org/biolink/vocab/log_odds_ratio,log odds ratio,The natural logarithm of the odds ratio for an event or association in an exposed group versus a non-exposed group.,Predicate,https://w3id.org/biolink/vocab/has_study_results,https://w3id.org/biolink/vocab/LogOddsAnalysisResult,
https://w3id.org/biolink/vocab/log_odds_ratio_95_ci,log odds ratio 95 ci,The 95 percent confidence interval within which the true log odds ratio for the sample population is expected to fall.,Predicate,https://w3id.org/biolink/vocab/has_study_results,https://w3id.org/biolink/vocab/LogOddsAnalysisResult,
https://w3id.org/biolink/vocab/object,object,"Connects an association to the object of the association, such as the phenotype in a disease-to-phenotype association.",Predicate,,https://w3id.org/biolink/vocab/DiseaseToPhenotypicFeatureAssociation|https://w3id.org/biolink/vocab/EntityToDiseaseAssociation|https://w3id.org/biolink/vocab/PhenotypicFeatureToPhenotypicFeatureAssociation,https://w3id.org/biolink/vocab/Disease|https://w3id.org/biolink/vocab/PhenotypicFeature
https://w3id.org/biolink/vocab/predicate,predicate,"The relationship type or edge label for an association, corresponding to rdf:predicate in RDF.",Predicate,,https://w3id.org/biolink/vocab/DiseaseToPhenotypicFeatureAssociation|https://w3id.org/biolink/vocab/EntityToDiseaseAssociation|https://w3id.org/biolink/vocab/PhenotypicFeatureToPhenotypicFeatureAssociation,
https://w3id.org/biolink/vocab/subject,subject,"Connects an association to the subject of the association, such as the disease in a disease-to-phenotype association.",Predicate,,https://w3id.org/biolink/vocab/DiseaseToPhenotypicFeatureAssociation|https://w3id.org/biolink/vocab/EntityToDiseaseAssociation|https://w3id.org/biolink/vocab/PhenotypicFeatureToPhenotypicFeatureAssociation,https://w3id.org/biolink/vocab/Disease|https://w3id.org/biolink/vocab/PhenotypicFeature
https://w3id.org/biolink/vocab/supporting_data_set,supporting data set,Connects a study result or analysis result to the dataset that supports it.,Predicate,https://w3id.org/biolink/vocab/has_study_results,https://w3id.org/biolink/vocab/ConceptCountAnalysisResult,https://w3id.org/biolink/vocab/Dataset
https://w3id.org/biolink/vocab/total_sample_size,total sample size,The total sample size represented by an analysis result.,Predicate,https://w3id.org/biolink/vocab/has_study_results,https://w3id.org/biolink/vocab/LogOddsAnalysisResult,
